{
  "schema_version": 1,
  "id": {
    "alphabet": "23456789ABCDEFGHJKMNPQRSTUVWXYZ",
    "canonicalLength": 14,
    "prefixLength": 8,
    "legacyCanonicalLength": 12
  },
  "statuses": ["unbound", "bound", "void"],
  "fields": [
    {
      "key": "id",
      "label": "ID",
      "type": "string",
      "editable": false,
      "validation": {
        "required": true,
        "pattern": "^[23456789ABCDEFGHJKMNPQRSTUVWXYZ]{14}$"
      }
    },
    {
      "key": "status",
      "label": "Status",
      "type": "dropdown",
      "editable": false,
      "options": ["unbound", "bound", "void"],
      "on_unknown": "block",
      "validation": { "required": true }
    },
    {
      "key": "minted_at",
      "label": "Minted at",
      "type": "date",
      "editable": false
    },
    {
      "key": "batch",
      "label": "Batch",
      "type": "string",
      "editable": false
    },
    {
      "key": "bound_at",
      "label": "Bound at",
      "type": "date",
      "editable": false,
      "meaningfulFrom": "bound"
    },
    {
      "key": "type",
      "label": "Type",
      "type": "string",
      "editable": true,
      "meaningfulFrom": "bound",
      "validation": { "maxLength": 100 }
    },
    {
      "key": "description",
      "label": "Description",
      "type": "string",
      "editable": true,
      "meaningfulFrom": "bound",
      "validation": { "maxLength": 500 }
    },
    {
      "key": "vendor",
      "label": "Vendor",
      "type": "dropdown",
      "editable": true,
      "meaningfulFrom": "bound",
      "options": ["TC Direct", "Adafruit", "Mouser", "Digi-Key", "RS Components", "Farnell"],
      "on_unknown": "warn",
      "validation": { "maxLength": 200 }
    },
    {
      "key": "part_number",
      "label": "Part number",
      "type": "string",
      "editable": true,
      "meaningfulFrom": "bound",
      "validation": { "maxLength": 100 }
    },
    {
      "key": "location",
      "label": "Location",
      "type": "string",
      "editable": true,
      "meaningfulFrom": "bound",
      "validation": { "maxLength": 200 }
    },
    {
      "key": "notes",
      "label": "Notes",
      "type": "string",
      "editable": true,
      "validation": { "maxLength": 1000 }
    },
    {
      "key": "minted_by",
      "label": "Minted by",
      "type": "string",
      "editable": false
    },
    {
      "key": "bound_by",
      "label": "Bound by",
      "type": "string",
      "editable": false,
      "meaningfulFrom": "bound"
    },
    {
      "key": "last_edited_at",
      "label": "Last edited at",
      "type": "date",
      "editable": false
    },
    {
      "key": "last_edited_by",
      "label": "Last edited by",
      "type": "string",
      "editable": false
    }
  ]
}
